{
  "schemaVersion": "1.0",
  "documentType": "SIMPLIFIED_INVOICE",
  "invoiceNumber": "CC-2026-1004",
  "issueDate": "2026-09-10",
  "currency": "EUR",
  "supplier": {
    "name": "Le Petit Bouchon SARL",
    "vatNumber": "FR09876543210",
    "address": {
      "street": "Beispielstrasse 1",
      "postalCode": "06000",
      "city": "Nice",
      "countryCode": "FR"
    }
  },
  "customer": {
    "name": "Példa Tech Kft.",
    "vatNumber": "HU12345678"
  },
  "lines": [
    {
      "description": "Déjeuner affaires",
      "category": "FOOD_AND_DRINK",
      "netAmount": "41.60",
      "vatRate": 10.0,
      "vatAmount": "4.16",
      "grossAmount": "45.76"
    },
    {
      "description": "Café",
      "category": "FOOD_AND_DRINK",
      "netAmount": "3.20",
      "vatRate": 10.0,
      "vatAmount": "0.32",
      "grossAmount": "3.52"
    }
  ],
  "totals": {
    "netAmount": "44.80",
    "vatAmount": "4.48",
    "grossAmount": "49.28"
  },
  "cardLast4": "4821"
}
